Symbol,Name,Last Sale,Net Change,% Change,Market Cap,Country,IPO Year,Volume,Sector,Industry
KIM^M,Kimco Realty Corporation Class M Depositary Shares each of which represents a one-one thousandth fractional interest in a share of 5.25% Class M Cumulative Redeemable Preferred Stock liquidation preference $25000.00 per share,$20.20,0.0699,0.347%,,United States,,7226,,
KIM^N,Kimco Realty Corporation Depositary Shares each representing 1/1000th interest in a share of 7.25% Class N Cumulative Convertible Perpetual Preferred Stock,$59.00,0.00,0.00%,,United States,,37,,
KIND,Nextdoor Holdings Inc. Class A Common Stock,$1.655,0.005,0.303%,633183895.00,United States,,488369,Technology,Computer Software: Programming Data Processing
KINS,Kingstone Companies Inc. Common Stock,$14.97,-0.07,-0.465%,209666781.00,United States,,105477,Finance,Property-Casualty Insurers
KIO,KKR Income Opportunities Fund Common Shares,$12.275,0.015,0.122%,0.00,United States,2013,116848,Finance,Investment Managers
KIRK,Kirkland's Inc. COMMONSTOCK,$1.25,-0.01,-0.794%,28067935.00,United States,2002,57217,Consumer Discretionary,Other Specialty Stores
KITT,Nauticus Robotics Inc. Common stock,$0.9899,-0.0081,-0.812%,36922863.00,United States,2021,772304,Industrials,Industrial Machinery/Components
KITTW,Nauticus Robotics Inc. Warrant,$0.0695,0.0093,15.449%,2592321.00,United States,2021,10564,Industrials,Industrial Machinery/Components
KKR,KKR & Co. Inc. Common Stock,$122.73,-0.52,-0.422%,109308480755.00,United States,,1395993,Finance,Investment Managers
KKR^D,KKR & Co. Inc. 6.25% Series D Mandatory Convertible Preferred Stock,$50.50,-1.26,-2.434%,,United States,,18850,,
KKRS,KKR Group Finance Co. IX LLC 4.625% Subordinated Notes due 2061,$17.50,-0.01,-0.057%,15586233303.00,United States,2021,13556,,
KKRT,KKR & Co. Inc. 6.875% Subordinated Notes due 2065,$25.129,0.009,0.036%,0.00,United States,2025,91060,Finance,Investment Managers
KLAC,KLA Corporation Common Stock,$851.395,22.105,2.666%,112589692295.00,United States,1980,611394,Technology,Electronic Components
KLC,KinderCare Learning Companies Inc. Common Stock,$10.80,-0.17,-1.55%,1274468321.00,United States,2024,125807,Consumer Discretionary,Other Consumer Services
KLG,WK Kellogg Co Common Stock,$15.84,-0.09,-0.565%,1366401564.00,United States,2023,289057,Consumer Staples,Packaged Foods
KLIC,Kulicke and Soffa Industries Inc. Common Stock,$35.44,1.28,3.747%,1870145693.00,Singapore,,443289,Technology,Semiconductors
KLRS,Kalaris Therapeutics Inc. Common Stock,$3.255,0.195,6.373%,60876371.00,United States,2020,8011,Health Care,Biotechnology: Biological Products (No Diagnostic Substances)
KLTO,Klotho Neurosciences Inc. Common Stock,$2.01,0.19,10.44%,65313722.00,United States,2022,306970745,Health Care,Biotechnology: Biological Products (No Diagnostic Substances)
KLTOW,Klotho Neurosciences Inc. Warrant,$0.2725,0.1425,109.615%,8854721.00,United States,2022,5693481,Health Care,Biotechnology: Biological Products (No Diagnostic Substances)
KLTR,Kaltura Inc. Common Stock,$2.065,-0.115,-5.275%,317223601.00,United States,2021,226568,Technology,Computer Software: Prepackaged Software
KLXE,KLX Energy Services Holdings Inc. Common Stock,$2.17,0.21,10.714%,38092039.00,United States,,128884,Energy,Oilfield Services/Equipment
KMB,Kimberly-Clark Corporation Common Stock,$132.95,0.26,0.196%,44114941853.00,United States,,749219,Consumer Discretionary,Containers/Packaging
KMDA,Kamada Ltd. Ordinary Shares,$7.00,0.03,0.43%,402535217.00,Israel,2013,41384,Health Care,Biotechnology: Pharmaceutical Preparations
KMI,Kinder Morgan Inc. Common Stock,$27.435,-0.095,-0.345%,60962456047.00,United States,2011,7493170,Utilities,Natural Gas Distribution
KMPB,Kemper Corporation 5.875% Fixed-Rate Reset Junior Subordinated Debentures due 2062,$23.31,0.02,0.086%,1491721375.00,United States,2022,14964,Finance,Property-Casualty Insurers
KMPR,Kemper Corporation,$61.65,-1.38,-2.189%,3945286263.00,United States,,207047,Finance,Property-Casualty Insurers
KMT,Kennametal Inc. Common Stock,$22.365,0.195,0.88%,1704963659.00,United States,,166122,Industrials,Industrial Machinery/Components
KMTS,Kestra Medical Technologies Ltd. Common Stock,$21.115,-0.055,-0.26%,1084226871.00,United States,2025,73940,Health Care,Medical/Dental Instruments
KMX,CarMax Inc,$68.45,1.25,1.86%,10451235201.00,United States,,1277393,Consumer Discretionary,Retail-Auto Dealers and Gas Stations
KN,Knowles Corporation Common Stock,$17.62,0.14,0.801%,1532500117.00,United States,2014,183262,Consumer Staples,Consumer Electronics/Appliances
KNDI,Kandi Technologies Group Inc. Ordinary Shares,$1.11,-0.01,-0.893%,96967640.00,China,,35695,Consumer Discretionary,Auto Manufacturing
KNF,Knife Riv Holding Co. Common Stock,$90.30,-2.45,-2.642%,5115708198.00,United States,2023,287430,Industrials,Mining & Quarrying of Nonmetallic Minerals (No Fuels)
KNOP,KNOT Offshore Partners LP Common Units representing Limited Partner Interests,$6.44,0.04,0.625%,219250322.00,United Kingdom,2013,23450,Consumer Discretionary,Marine Transportation
KNSA,Kiniksa Pharmaceuticals International plc Class A Ordinary Shares,$30.02,-0.31,-1.022%,2190588429.00,United States,2018,262065,Health Care,Biotechnology: Pharmaceutical Preparations
KNSL,Kinsale Capital Group Inc. Common Stock,$458.95,-4.56,-0.984%,10698783093.00,United States,,199090,Finance,Property-Casualty Insurers
KNTK,Kinetik Holdings Inc. Class A Common Stock,$43.47,0.19,0.439%,6866594447.00,United States,2022,543203,Utilities,Natural Gas Distribution
KNW,Know Labs Inc. Common Stock,$2.59,-0.45,-14.803%,19425000.00,,,7364478,Industrials,Industrial Machinery/Components
KNX,Knight-Swift Transportation Holdings Inc.,$45.515,1.155,2.604%,7375705750.00,United States,2017,1299264,Industrials,Trucking Freight/Courier Services
KO,Coca-Cola Company (The) Common Stock,$72.565,0.795,1.108%,312339115843.00,United States,,6262835,Consumer Staples,Beverages (Production/Distribution)
KOD,Kodiak Sciences Inc Common Stock,$4.25,0.10,2.41%,224245049.00,United States,2018,223555,Health Care,Biotechnology: Biological Products (No Diagnostic Substances)
KODK,Eastman Kodak Company Common New,$5.895,0.035,0.597%,476316000.00,United States,,344593,Consumer Discretionary,Industrial Machinery/Components
KOF,Coca Cola Femsa S.A.B. de C.V.  American Depositary Shares each representing 10 Units (each Unit consists of 3 Series B Shares and 5 Series L Shares),$96.40,-1.36,-1.391%,20252022986.00,Mexico,1993,105793,Consumer Staples,Beverages (Production/Distribution)
KOP,Koppers Holdings Inc. Common Stock,$33.24,0.36,1.095%,665134660.00,United States,2006,52239,Basic Materials,Forest Products
KOPN,Kopin Corporation Common Stock,$1.6035,-0.0665,-3.982%,261046468.00,United States,1992,1618922,Technology,Semiconductors
KORE,KORE Group Holdings Inc. Common Stock,$2.60,-0.02,-0.763%,44616159.00,United States,,2781,Telecommunications,Telecommunications Equipment
KOS,Kosmos Energy Ltd. Common Shares (DE),$2.005,0.035,1.777%,958408169.00,Bermuda,2011,9282090,Energy,Oil & Gas Production
KOSS,Koss Corporation Common Stock,$6.01,-0.03,-0.497%,56348528.00,United States,,28036,Consumer Staples,Consumer Electronics/Appliances
KPLT,Katapult Holdings Inc. Common Stock,$8.88,-0.06,-0.671%,40293604.00,United States,2019,11248,Consumer Discretionary,Diversified Commercial Services
KPLTW,Katapult Holdings Inc. Warrant,$0.006,-0.0006,-9.091%,27225.00,United States,2019,100,Consumer Discretionary,Diversified Commercial Services
KPRX,Kiora Pharmaceuticals Inc.  Common Stock,$3.2935,0.0435,1.338%,10024943.00,United States,,65589,Health Care,Biotechnology: Pharmaceutical Preparations
KPTI,Karyopharm Therapeutics Inc. Common Stock,$4.47,0.26,6.176%,38620371.00,United States,2013,56630,Health Care,Biotechnology: Pharmaceutical Preparations
KR,Kroger Company (The) Common Stock,$65.505,0.015,0.023%,43291827080.00,United States,,2402260,Consumer Staples,Food Chains
KRC,Kilroy Realty Corporation Common Stock,$35.38,0.41,1.172%,4184766991.00,United States,1997,765660,Real Estate,Real Estate Investment Trusts
KREF,KKR Real Estate Finance Trust Inc. Common Stock,$9.37,0.06,0.644%,635344928.00,United States,2017,196012,Real Estate,Real Estate Investment Trusts
KREF^A,KKR Real Estate Finance Trust Inc. 6.50% Series A Cumulative Redeemable Preferred Stock,$19.53,0.22,1.139%,,United States,,13318,,
KRG,Kite Realty Group Trust Common Stock,$22.915,0.275,1.215%,5036998855.00,United States,2004,799817,Real Estate,Real Estate Investment Trusts
KRKR,36Kr Holdings Inc. American Depositary Shares,$5.91,0.1021,1.758%,232945268.00,China,2019,2664,Consumer Discretionary,Business Services
KRMD,KORU Medical Systems Inc. Common Stock (DE),$3.19,0.17,5.629%,147189777.00,United States,,82642,Health Care,Medical/Dental Instruments
KRMN,Karman Holdings Inc. Common Stock,$44.0413,-2.6387,-5.653%,5821140903.00,,2025,501785,Industrials,Military/Government/Technical
KRNT,Kornit Digital Ltd. Ordinary Shares,$22.49,-0.26,-1.143%,1019415542.00,Israel,2015,209000,Industrials,Industrial Machinery/Components
KRNY,Kearny Financial Corp Common Stock,$6.265,0.105,1.705%,404591714.00,United States,2005,115475,Finance,Savings Institutions
KRO,Kronos Worldwide Inc Common Stock,$6.97,0.38,5.766%,801803123.00,United States,,306259,Industrials,Major Chemicals
KRON,Kronos Bio Inc. Common Stock,$0.8875,0.0175,2.011%,54110177.00,United States,2020,246655,Health Care,Biotechnology: Pharmaceutical Preparations
KROS,Keros Therapeutics Inc. Common Stock,$13.91,-0.18,-1.278%,564960409.00,United States,2020,660275,Health Care,Biotechnology: Pharmaceutical Preparations
KRP,Kimbell Royalty Partners Common Units Representing Limited Partner Interests,$13.76,0.15,1.102%,1484539265.00,United States,2017,304851,Energy,Oil & Gas Production
KRRO,Korro Bio Inc. Common Stock,$15.745,0.895,6.027%,147853297.00,United States,2019,128326,Health Care,Biotechnology: Pharmaceutical Preparations
KRT,Karat Packaging Inc. Common Stock,$31.335,0.015,0.048%,628564589.00,United States,2021,5174,Industrials,Plastic Products
KRUS,Kura Sushi USA Inc. Class A Common Stock,$79.315,-1.945,-2.394%,958558974.00,United States,2019,182939,Consumer Discretionary,Restaurants
KRYS,Krystal Biotech Inc. Common Stock,$137.95,1.87,1.374%,3986572906.00,United States,2017,79701,Health Care,Biotechnology: Biological Products (No Diagnostic Substances)
KSCP,Knightscope Inc. Class A Common Stock,$6.145,-0.095,-1.522%,42408028.00,United States,2022,124999,Telecommunications,Telecommunications Equipment
KSPI,Joint Stock Company Kaspi.kz American Depository Shares,$86.165,0.545,0.637%,16313918012.00,Kazakhstan,2024,209725,,
KSS,Kohl's Corporation Common Stock,$9.505,0.495,5.494%,1064956159.00,United States,1992,5777106,Consumer Discretionary,Department/Specialty Retail Stores
KT,KT Corporation Common Stock,$19.6562,-0.2238,-1.126%,9664283106.00,South Korea,,234690,Telecommunications,Telecommunications Equipment
KTB,Kontoor Brands Inc. Common Stock ,$68.43,0.16,0.234%,3802064618.00,United States,2019,349422,Consumer Discretionary,Apparel
KTCC,Key Tronic Corporation Common Stock,$2.91,0.03,1.042%,31317045.00,United States,1983,1849,Technology,Electrical Products
KTF,DWS Municipal Income Trust,$8.81,-0.04,-0.452%,348003264.00,United States,1988,64317,Finance,Finance Companies
KTH,Structures Products Cp 8% CorTS Issued by Peco Energy Cap Tr II Preferred Stock,$28.5229,0.00,0.00%,0.00,United States,,30,Finance,Finance: Consumer Services
KTN,Structured Products Corp 8.205% CorTS 8.205% Corporate Backed Trust Securities (CorTS),$26.50,-0.27,-1.009%,0.00,United States,,260,Finance,Finance: Consumer Services
KTOS,Kratos Defense & Security Solutions Inc. Common Stock,$39.20,-1.39,-3.424%,6014979006.00,United States,,1600864,Industrials,Military/Government/Technical
KTTA,Pasithea Therapeutics Corp. Common Stock,$0.89,-0.01,-1.111%,6624784.00,United States,2021,162979,Health Care,Biotechnology: Pharmaceutical Preparations
KTTAW,Pasithea Therapeutics Corp. Warrant,$0.015,-0.005,-25.00%,111654.00,United States,2021,850,Health Care,Biotechnology: Pharmaceutical Preparations
KUKE,Kuke Music Holding Limited American Depositary Shares (each representing ten (10) Class A Ordinary Shares),$3.00,-0.01,-0.332%,60972885.00,,,7026,Real Estate,Other Consumer Services
KULR,KULR Technology Group Inc. Common Stock,$1.195,-0.035,-2.846%,356667270.00,United States,,5085250,Technology,Electrical Products
KURA,Kura Oncology Inc. Common Stock,$6.835,0.105,1.56%,591737986.00,United States,,348658,Health Care,Biotechnology: Pharmaceutical Preparations
KVAC,Keen Vision Acquisition Corporation Ordinary Shares,$11.30,-0.01,-0.088%,0.00,United States,2023,130,,
KVHI,KVH Industries Inc. Common Stock,$5.21,-0.03,-0.573%,102113192.00,United States,1996,11952,Technology,Radio And Television Broadcasting And Communications Equipment
KVUE,Kenvue Inc. Common Stock,$21.545,0.245,1.15%,41364459614.00,United States,2023,7066107,Consumer Discretionary,Specialty Chemicals
KVYO,Klaviyo Inc. Series A Common Stock,$34.43,-0.33,-0.949%,9502688298.00,United States,2023,1381686,Technology,Computer Software: Prepackaged Software
KW,Kennedy-Wilson Holdings Inc. Common Stock,$6.74,0.11,1.659%,932096761.00,United States,,478899,Finance,Real Estate
KWE,KWESST Micro Systems Inc. Common Stock,$5.93,-0.17,-2.787%,3145059.00,Canada,,57197,Technology,Computer Software: Prepackaged Software
KWESW,KWESST Micro Systems Inc. Warrant,$0.0357,-0.0093,-20.667%,18934.00,Canada,,19833,Technology,Computer Software: Prepackaged Software
KWM,K Wave Media Ltd. Ordinary Shares,$6.8953,1.3853,25.142%,435520939.00,Cayman Islands,,9019073,Consumer Discretionary,Movies/Entertainment
KWMWW,K Wave Media Ltd. Warrant,$0.2625,0.0225,9.375%,16580025.00,Cayman Islands,,833679,Consumer Discretionary,Movies/Entertainment
KWR,Quaker Houghton Common Stock,$120.67,0.49,0.408%,2133524639.00,United States,,74963,Industrials,Major Chemicals
KXIN,Kaixin Holdings Ordinary Shares,$0.9595,-0.0005,-0.052%,10509715.00,China,2017,45281,Consumer Discretionary,Retail-Auto Dealers and Gas Stations
KYMR,Kymera Therapeutics Inc. Common Stock,$48.39,1.23,2.608%,3151135896.00,United States,2020,539861,Health Care,Biotechnology: Biological Products (No Diagnostic Substances)
KYN,Kayne Anderson Energy Infrastructure Fund Inc.,$12.25,0.02,0.164%,1667611243.00,United States,2004,224889,Finance,Finance/Investors Services
KYTX,Kyverna Therapeutics Inc. Common Stock,$3.65,0.20,5.797%,157748886.00,United States,2024,450141,Health Care,Biotechnology: Biological Products (No Diagnostic Substances)
KZIA,Kazia Therapeutics Limited American Depositary Shares,$5.31,0.01,0.189%,7219609.00,Australia,,11377,Health Care,Biotechnology: Pharmaceutical Preparations
KZR,Kezar Life Sciences Inc. Common Stock,$4.77,0.32,7.191%,34848666.00,United States,2018,15610,Health Care,Biotechnology: Pharmaceutical Preparations
L,Loews Corporation Common Stock,$88.48,0.12,0.136%,18553948797.00,United States,,361667,Finance,Property-Casualty Insurers
LAB,Standard BioTools Inc. Common Stock,$1.10,0.02,1.852%,417804495.00,United States,2011,721348,Industrials,Biotechnology: Laboratory Analytical Instruments
LAC,Lithium Americas Corp. Common Shares,$2.745,-0.025,-0.903%,600294338.00,Canada,2023,2330116,Basic Materials,Metal Mining
LAD,Lithia Motors Inc. Common Stock,$338.18,14.62,4.518%,8803018839.00,United States,,121963,Consumer Discretionary,Retail-Auto Dealers and Gas Stations
LADR,Ladder Capital Corp Class A Common Stock,$10.80,0.10,0.935%,1383441833.00,United States,2014,178362,Real Estate,Real Estate Investment Trusts
LAES,SEALSQ Corp Ordinary Shares,$3.92,0.01,0.256%,409674892.00,Switzerland,,14108152,Technology,Semiconductors
LAKE,Lakeland Industries Inc. Common Stock,$15.675,-3.685,-19.034%,148890618.00,United States,1986,1082056,Health Care,Industrial Specialties
LAMR,Lamar Advertising Company Class A Common Stock,$120.7038,0.0038,0.003%,12358866910.00,United States,1996,138797,Real Estate,Real Estate Investment Trusts
LANC,Lancaster Colony Corporation Common Stock,$170.955,0.655,0.385%,4713058395.00,United States,,48534,Consumer Staples,Packaged Foods
LAND,Gladstone Land Corporation Common Stock,$10.28,0.27,2.697%,371978284.00,United States,2013,227542,Real Estate,Real Estate Investment Trusts
LANDM,Gladstone Land Corporation 5.00% Series D Cumulative Term Preferred Stock,$24.7199,0.0699,0.284%,894481127.00,United States,,338,Real Estate,Real Estate Investment Trusts
LANDO,Gladstone Land Corporation 6.00% Series B Cumulative Redeemable Preferred Stock,$19.58,0.08,0.41%,708495604.00,United States,,5005,Real Estate,Real Estate Investment Trusts
LANDP,Gladstone Land Corporation 6.00% Series C Cumulative Redeemable Preferred Stock,$19.49,-0.018,-0.092%,705238984.00,United States,,8390,Real Estate,Real Estate Investment Trusts
LANV,Lanvin Group Holdings Limited Ordinary Shares,$2.10,0.00,0.00%,293529188.00,Cayman Islands,2022,51667,Consumer Discretionary,Apparel
LAR,Lithium Argentina AG Common Shares,$1.955,-0.025,-1.263%,316514500.00,Canada,2023,355014,Basic Materials,Metal Mining
LARK,Landmark Bancorp Inc. Common Stock,$28.76,0.46,1.625%,166321352.00,United States,,5509,Finance,Major Banks
LASE,Laser Photonics Corporation Common Stock,$2.405,-0.065,-2.632%,33266910.00,United States,2022,47363,Miscellaneous,Industrial Machinery/Components
LASR,nLIGHT Inc. Common Stock,$17.37,-0.26,-1.475%,858763611.00,United States,2018,236726,Technology,Semiconductors
LAUR,Laureate Education Inc. Common Stock,$21.745,-0.175,-0.798%,3235876994.00,United States,2017,181116,Real Estate,Other Consumer Services
LAW,CS Disco Inc. Common Stock,$4.42,0.09,2.079%,268767174.00,United States,2021,18477,Technology,Computer Software: Prepackaged Software
LAZ,Lazard Inc. Common Stock,$42.99,-0.95,-2.162%,4847814252.00,Bermuda,2005,344244,Finance,Investment Managers
LAZR,Luminar Technologies Inc.  Class A Common Stock,$3.445,0.105,3.144%,161497545.00,United States,2019,2110431,Consumer Discretionary,Auto Parts:O.E.M.
LB,LandBridge Company LLC Class A Shares Representing Limited Liability Company Interests,$72.61,-0.39,-0.534%,5547179998.00,,2024,213924,Energy,Oil & Gas Production
LBGJ,Li Bang International Corporation Inc. Ordinary Shares,$1.6182,0.0882,5.765%,29969064.00,China,2024,27374,,
LBRDA,Liberty Broadband Corporation Class A Common Stock,$94.65,1.84,1.983%,13566231352.00,United States,,164316,Telecommunications,Cable & Other Pay Television Services
LBRDK,Liberty Broadband Corporation Class C Common Stock,$95.46,1.83,1.955%,13682329053.00,United States,,744870,Telecommunications,Cable & Other Pay Television Services
LBRDP,Liberty Broadband Corporation Series A Cumulative Redeemable Preferred Stock,$24.2888,0.1288,0.533%,3481325727.00,United States,,5223,Telecommunications,Cable & Other Pay Television Services
LBRT,Liberty Energy Inc. Class A common stock,$12.885,0.615,5.012%,2086780047.00,United States,2018,1273207,Energy,Oilfield Services/Equipment
LBTYA,Liberty Global Ltd. Class A Common Shares,$9.905,0.315,3.285%,3422956915.00,United Kingdom,,573296,Telecommunications,Cable & Other Pay Television Services
LBTYB,Liberty Global Ltd. Class B Common Shares,$9.73,-0.16,-1.618%,3362480644.00,United Kingdom,,989,Telecommunications,Cable & Other Pay Television Services
LBTYK,Liberty Global Ltd. Class C Common Shares,$10.135,0.305,3.103%,3502440013.00,United Kingdom,,332724,Telecommunications,Cable & Other Pay Television Services
LC,LendingClub Corporation Common Stock,$10.92,0.22,2.056%,1247062165.00,United States,2014,493360,Finance,Finance: Consumer Services
LCCCU,Lakeshore Acquisition III Corp. Unit,$10.0936,0.0036,0.036%,0.00,United States,2025,638,Finance,Blank Checks
LCFY,Locafy Limited Ordinary Share,$3.62,-0.32,-8.122%,5003510.00,Australia,2022,10230,Technology,Computer Software: Programming Data Processing
LCFYW,Locafy Limited Warrant,$9.35,-0.70,-6.965%,12923430.00,Australia,2022,606,Technology,Computer Software: Programming Data Processing
LCID,Lucid Group Inc. Common Stock,$2.22,-0.01,-0.448%,6771581718.00,United States,,58729270,Consumer Discretionary,Auto Manufacturing
LCII,LCI Industries,$92.66,1.89,2.082%,2338521483.00,United States,1995,103760,Consumer Discretionary,Auto Parts:O.E.M.
LCNB,LCNB Corporation Common Stock,$14.775,0.415,2.89%,209323749.00,United States,,8285,Finance,Major Banks
LCTX,Lineage Cell Therapeutics Inc. Common Stock,$0.7523,0.0335,4.661%,171792437.00,United States,,5778932,Health Care,Biotechnology: Biological Products (No Diagnostic Substances)
LCUT,Lifetime Brands Inc. Common Stock,$4.0717,0.3017,8.003%,91263104.00,United States,1991,63362,Consumer Discretionary,Industrial Machinery/Components
LDI,loanDepot Inc. Class A Common Stock,$1.37,0.07,5.385%,451977432.00,United States,2021,588106,Finance,Finance: Consumer Services
LDOS,Leidos Holdings Inc. Common Stock,$145.70,-0.64,-0.437%,18754339650.00,United States,,237253,Technology,EDP Services
LDP,Cohen & Steers Limited Duration Preferred and Income Fund Inc.,$20.60,-0.09,-0.435%,0.00,United States,2012,45803,Finance,Finance Companies
LDTC,LeddarTech Holdings Inc. Common Shares,$0.3784,-0.0194,-4.877%,11429071.00,United States,2021,136266,Technology,Computer Software: Prepackaged Software
LDTCW,LeddarTech Holdings Inc. Warrants,$0.0328,0.00,0.00%,990681.00,United States,2021,21,Technology,Computer Software: Prepackaged Software
LDWY,Lendway Inc. Common Stock (DE),$4.9774,0.0474,0.961%,8808002.00,United States,,4409,Consumer Staples,Farming/Seeds/Milling
LE,Lands' End Inc. Common Stock,$8.71,-0.33,-3.65%,265417313.00,United States,,325609,Consumer Discretionary,Clothing/Shoe/Accessory Stores
LEA,Lear Corporation Common Stock,$95.295,4.895,5.415%,5094803470.00,United States,,412482,Consumer Discretionary,Auto Parts:O.E.M.
LECO,Lincoln Electric Holdings Inc. Common Shares,$203.745,0.755,0.372%,11374326234.00,United States,,129768,Industrials,Industrial Machinery/Components
LEDS,SemiLEDS Corporation Common Stock,$2.985,0.02,0.675%,24479886.00,Taiwan,2010,27261,Technology,Semiconductors
LEE,Lee Enterprises Incorporated Common Stock,$6.41,-0.29,-4.328%,39870610.00,United States,,8977,Consumer Discretionary,Newspapers/Magazines
LEG,Leggett & Platt Incorporated Common Stock,$9.605,0.355,3.838%,1298063057.00,United States,,678944,Consumer Discretionary,Home Furnishings
LEGH,Legacy Housing Corporation Common Stock (TX),$22.49,0.31,1.398%,542411481.00,United States,2018,22223,Consumer Discretionary,Homebuilding
LEGN,Legend Biotech Corporation American Depositary Shares,$37.52,2.74,7.878%,6890516408.00,United States,2020,1779638,Health Care,Biotechnology: Pharmaceutical Preparations
LEGT,Legato Merger Corp. III Ordinary Shares,$10.62,0.00,0.00%,0.00,,2024,67,,
LEN,Lennar Corporation Class A Common Stock,$113.49,3.12,2.827%,29938001375.00,United States,,1107362,Consumer Discretionary,Homebuilding
LENZ,LENZ Therapeutics Inc. Common Stock,$28.97,-2.25,-7.207%,815394081.00,United States,2021,277167,Health Care,Biotechnology: Biological Products (No Diagnostic Substances)
LEO,BNY Mellon Strategic Municipals Inc. Common Stock,$5.79,0.00,0.00%,360664045.00,United States,1987,92292,Finance,Trusts Except Educational Religious and Charitable
LESL,Leslie's Inc. Common Stock,$0.6893,-0.0207,-2.915%,127811148.00,United States,2020,1676817,Consumer Discretionary,Other Specialty Stores
LEU,Centrus Energy Corp. Class A Common Stock,$142.7525,-3.3275,-2.278%,2329444717.00,United States,2014,612159,Industrials,Mining & Quarrying of Nonmetallic Minerals (No Fuels)
LEVI,Levi Strauss & Co Class A Common Stock,$17.625,0.105,0.599%,6967656705.00,United States,2019,542332,Consumer Discretionary,Apparel
LEXX,Lexaria Bioscience Corp. Common Stock,$1.03,0.03,3.00%,18085954.00,Canada,,27325,Health Care,Biotechnology: Pharmaceutical Preparations
LFCR,Lifecore Biomedical Inc. Common Stock,$6.87,0.09,1.327%,254364024.00,United States,,28509,Health Care,Biotechnology: Pharmaceutical Preparations
LFMD,LifeMD Inc. Common Stock,$11.98,-0.47,-3.775%,544462296.00,United States,,1164469,Health Care,Medical/Nursing Services
LFMDP,LifeMD Inc. 8.875% Series A Cumulative Perpetual Preferred Stock,$23.46,0.00,0.00%,1066200790.00,United States,,102,Health Care,Medical/Nursing Services
LFST,LifeStance Health Group Inc. Common Stock,$5.755,-0.125,-2.126%,2237980839.00,United States,2021,664750,Health Care,Medical/Nursing Services
LFT,Lument Finance Trust Inc. Common Stock,$2.565,0.005,0.195%,134212271.00,United States,2013,43853,Real Estate,Real Estate Investment Trusts
LFT^A,Lument Finance Trust Inc. 7.875% Series A Cumulative Redeemable Preferred Stock,$21.41,0.00,0.00%,,United States,,101,,
LFUS,Littelfuse Inc. Common Stock,$226.615,3.925,1.763%,5600816239.00,United States,,78993,Energy,Electrical Products
LFVN,Lifevantage Corporation Common Stock (Delaware),$12.63,0.14,1.121%,158988751.00,United States,,47479,Health Care,Biotechnology: Pharmaceutical Preparations
LFWD,Lifeward Ltd. Ordinary Shares,$1.21,0.00,0.00%,13319186.00,Israel,2014,126352,Health Care,Industrial Specialties
LGCB,Linkage Global Inc. Class A Ordinary Shares,$2.32,0.00,0.00%,8305600.00,Japan,2023,10805,Consumer Discretionary,Catalog/Specialty Distribution
LGCL,Lucas GC Limited Ordinary Shares,$0.5949,-0.0051,-0.85%,47274952.00,China,2024,57153,Technology,Computer Software: Programming Data Processing
LGCY,Legacy Education Inc. Common Stock,$9.44,-0.07,-0.736%,116872458.00,,2024,52931,Real Estate,Other Consumer Services
LGHL,Lion Group Holding Ltd. American Depositary Share,$2.8955,0.1955,7.241%,1559661.00,China,,26738,Finance,Investment Bankers/Brokers/Service
LGHLW,Lion Group Holding Ltd. Warrant,$0.004,-0.001,-20.00%,2155.00,China,,1160479,Finance,Investment Bankers/Brokers/Service
LGI,Lazard Global Total Return and Income Fund Common Stock,$16.3407,-0.1393,-0.845%,0.00,United States,2004,29623,,
LGIH,LGI Homes Inc. Common Stock,$53.40,2.09,4.073%,1249800407.00,United States,2013,237541,Consumer Discretionary,Homebuilding
