Symbol,Name,Last Sale,Net Change,% Change,Market Cap,Country,IPO Year,Volume,Sector,Industry
PWOD,Penns Woods Bancorp Inc. Common Stock,$29.78,0.34,1.155%,226751293.00,United States,,6112,Finance,Major Banks
PWP,Perella Weinberg Partners Class A Common Stock,$18.62,-0.37,-1.948%,1645694644.00,United States,2020,310691,Finance,Finance: Consumer Services
PWR,Quanta Services Inc. Common Stock,$346.20,-9.46,-2.66%,51306395133.00,United States,,790144,Industrials,Engineering & Construction
PX,P10 Inc. Class A Common Stock,$10.095,0.205,2.073%,1131896585.00,United States,2021,285855,Finance,Investment Managers
PXLW,Pixelworks Inc.  Common Stock,$5.52,-0.32,-5.479%,28958190.00,United States,2000,43312,Technology,Semiconductors
PXS,Pyxis Tankers Inc. Common Stock,$2.7792,-0.0008,-0.029%,29142316.00,Greece,,5928,Consumer Discretionary,Marine Transportation
PXSAW,Pyxis Tankers Inc. Warrant,$0.0252,-0.0088,-25.882%,264244.00,Greece,,500,Consumer Discretionary,Marine Transportation
PYN,PIMCO New York Municipal Income Fund III Common Shares of Beneficial Interest,$5.27,0.01,0.19%,0.00,United States,2002,6391,Finance,Investment Managers
PYPD,PolyPid Ltd. Ordinary Shares,$3.4901,0.1301,3.872%,35567274.00,Israel,2020,1482142,Health Care,Biotechnology: Pharmaceutical Preparations
PYPL,PayPal Holdings Inc. Common Stock,$74.21,0.66,0.897%,72171661240.00,United States,,5305839,Consumer Discretionary,Business Services
PYXS,Pyxis Oncology Inc. Common Stock,$1.365,0.015,1.111%,84558563.00,United States,2021,188739,Health Care,Biotechnology: Pharmaceutical Preparations
PZC,PIMCO California Municipal Income Fund III Common Shares of Beneficial Interest,$6.1818,0.0068,0.11%,0.00,United States,2002,66122,Finance,Investment Managers
PZG,Paramount Gold Nevada Corp. Common Stock,$0.5887,-0.0313,-5.048%,42062115.00,United States,2015,271436,Basic Materials,Metal Mining
PZZA,Papa John's International Inc. Common Stock,$48.885,-1.645,-3.255%,1600418395.00,United States,1993,662223,Consumer Discretionary,Restaurants
QBTS,D-Wave Quantum Inc. Common Shares,$16.975,-0.975,-5.432%,4959946655.00,,2022,51294751,Technology,EDP Services
QCOM,QUALCOMM Incorporated Common Stock,$158.6792,3.2692,2.104%,174229761600.00,United States,1991,4557112,Technology,Radio And Television Broadcasting And Communications Equipment
QCRH,QCR Holdings Inc. Common Stock,$67.90,0.84,1.253%,1149643282.00,United States,,27956,Finance,Major Banks
QD,Qudian Inc. American Depositary Shares each representing one Class A Ordinary Share,$2.92,-0.02,-0.68%,482169357.00,China,2017,255839,Finance,Finance: Consumer Services
QDEL,QuidelOrtho Corporation Common Stock,$30.935,0.725,2.40%,2092006350.00,United States,,377234,Health Care,Biotechnology: In Vitro & In Vivo Diagnostic Substances
QETA,Quetta Acquisition Corporation Common Stock,$10.86,0.00,0.00%,0.00,United States,2023,5,Finance,Blank Checks
QETAR,Quetta Acquisition Corporation Right,$1.44,0.24,20.00%,0.00,United States,2023,200,Finance,Blank Checks
QFIN,Qifu Technology Inc. American Depositary Shares,$41.88,-0.81,-1.897%,5876382316.00,China,2018,503530,Finance,Finance: Consumer Services
QGEN,Qiagen N.V. Common Shares,$46.23,0.06,0.13%,9991047395.00,Netherlands,,756061,Health Care,Biotechnology: Biological Products (No Diagnostic Substances)
QH,Quhuo Limited American Depository Shares,$1.15,0.00,0.00%,103149266.00,China,2020,3479,Consumer Discretionary,Business Services
QIPT,Quipt Home Medical Corp. Common Shares,$2.07,-0.09,-4.167%,89929022.00,United States,,150629,Health Care,Misc Health and Biotechnology Services
QLGN,Qualigen Therapeutics Inc. Common Stock,$3.74,0.09,2.466%,2754252.00,United States,2015,494,Health Care,Biotechnology: Pharmaceutical Preparations
QLYS,Qualys Inc. Common Stock,$141.05,-0.72,-0.508%,5123800072.00,United States,2012,65143,Technology,Computer Software: Prepackaged Software
QMCO,Quantum Corporation Common Stock,$10.775,-0.375,-3.363%,62863494.00,United States,,1392664,Technology,Electronic Components
QMMM,QMMM Holdings Limited Class A Ordinary Shares,$1.05,0.03,2.941%,18066659.00,Hong Kong,2024,622282,Consumer Discretionary,Advertising
QNCX,Quince Therapeutics Inc. Common Stock,$1.195,0.025,2.137%,54335194.00,United States,2019,65239,Health Care,Biotechnology: Biological Products (No Diagnostic Substances)
QNRX,Quoin Pharmaceuticals Ltd. American Depositary Shares,$8.58,0.065,0.763%,5046464.00,Israel,2016,13142,Health Care,Medical/Dental Instruments
QNST,QuinStreet Inc. Common Stock,$15.945,-0.105,-0.654%,908098444.00,United States,2010,179114,Consumer Discretionary,Business Services
QNTM,Quantum Biopharma Ltd. Class B Subordinate Voting Shares,$14.009,-1.201,-7.896%,41063867.00,Canada,,271565,Health Care,Biotechnology: Pharmaceutical Preparations
QQQX,Nuveen NASDAQ 100 Dynamic Overwrite Fund Shares of Beneficial Interest,$26.10,0.08,0.307%,0.00,United States,,128271,Finance,Finance Companies
QRHC,Quest Resource Holding Corporation Common Stock,$2.12,-0.04,-1.852%,43749501.00,United States,,25837,Utilities,Environmental Services
QRVO,Qorvo Inc. Common Stock,$82.72,1.63,2.01%,7695042807.00,United States,,837794,Technology,Semiconductors
QS,QuantumScape Corporation Class A Common Stock,$4.345,-0.005,-0.115%,2428534700.00,United States,2020,6395316,Miscellaneous,Industrial Machinery/Components
QSEA,Quartzsea Acquisition Corporation Ordinary Shares,$10.0212,0.00,0.00%,0.00,United States,2025,122,Finance,Blank Checks
QSEAU,Quartzsea Acquisition Corporation Units,$10.31,0.00,0.00%,0.00,United States,2025,347,Finance,Blank Checks
QSG,QuantaSing Group Limited American Depositary Shares,$9.225,2.275,32.734%,471517453.00,China,2023,5329532,Real Estate,Other Consumer Services
QSI,Quantum-Si Incorporated Class A Common Stock,$1.685,-0.025,-1.462%,309194325.00,United States,2020,4009828,Industrials,Industrial Machinery/Components
QSIAW,Quantum-Si Incorporated Warrant,$0.66,-0.01,-1.493%,121108757.00,United States,2020,11368,Industrials,Industrial Machinery/Components
QSR,Restaurant Brands International Inc. Common Shares,$69.575,-0.175,-0.251%,31630632754.00,Canada,2014,724608,Consumer Discretionary,Restaurants
QTRX,Quanterix Corporation Common Stock,$6.38,1.32,26.087%,247731483.00,United States,2017,1979153,Industrials,Biotechnology: Laboratory Analytical Instruments
QTTB,Q32 Bio Inc. Common Stock,$1.6886,-0.1314,-7.22%,20596893.00,United States,2018,55846,Health Care,Biotechnology: Pharmaceutical Preparations
QTWO,Q2 Holdings Inc. Common Stock,$89.85,-1.02,-1.122%,5598000294.00,United States,2014,125891,Technology,Computer Software: Prepackaged Software
QUAD,Quad Graphics Inc Class A Common Stock,$5.47,-0.05,-0.906%,276850391.00,United States,,91559,Consumer Discretionary,Publishing
QUBT,Quantum Computing Inc. Common Stock,$14.9652,0.6252,4.36%,2108649597.00,United States,,57977632,Technology,Computer Software: Prepackaged Software
QUIK,QuickLogic Corporation Common Stock,$6.58,0.40,6.472%,104201268.00,United States,1999,270811,Technology,Semiconductors
QURE,uniQure N.V. Ordinary Shares,$16.28,-0.62,-3.669%,891305515.00,Netherlands,2014,400313,Health Care,Biotechnology: Pharmaceutical Preparations
QVCC,QVC Inc. 6.250% Senior Secured Notes due 2068,$8.41,0.11,1.325%,0.00,United States,2019,23762,Consumer Discretionary,Catalog/Specialty Distribution
QVCD,QVC Inc. 6.375% Senior Secured Notes due 2067,$8.40,-0.09,-1.06%,0.00,United States,2018,14553,Consumer Discretionary,Catalog/Specialty Distribution
QVCGA,QVC Group Inc. Series A Common Stock,$3.21,0.29,9.932%,25900623.00,United States,,150612,Consumer Discretionary,Catalog/Specialty Distribution
QVCGP,QVC Group Inc. 8.0% Fixed Rate Cumulative Redeemable Preferred Stock,$9.50,-0.25,-2.564%,76652935.00,United States,,89095,Consumer Discretionary,Catalog/Specialty Distribution
QXO,QXO Inc. Common Stock,$20.11,-0.02,-0.099%,11628919326.00,United States,,5456143,Technology,EDP Services
QXO^B,QXO Inc.  Depositary Shares each representing a 1/20th interest in a share of 5.50% Series B Mandatory Convertible Preferred Stock,$58.40,-0.09,-0.154%,,United States,,301846,,
R,Ryder System Inc. Common Stock,$154.025,0.975,0.637%,6367515488.00,United States,,80445,Consumer Discretionary,Rental/Leasing Companies
RA,Brookfield Real Assets Income Fund Inc. Common Stock,$12.965,-0.015,-0.116%,0.00,United States,2016,114535,Finance,Investment Managers
RAAQ,Real Asset Acquisition Corp. Class A Ordinary Share,$10.1199,-0.0001,-0.001%,0.00,United States,2025,5085,,
RAAQU,Real Asset Acquisition Corp. Unit,$10.29,0.04,0.39%,0.00,United States,2025,300,Finance,Blank Checks
RAAQW,Real Asset Acquisition Corp. Warrants,$0.3799,-0.0101,-2.59%,0.00,United States,2025,1300,,
RAC,Rithm Acquisition Corp. Class A Ordinary Shares,$10.08,-0.01,-0.099%,0.00,,2025,12809,,
RAC/WS,Rithm Acquisition Corp.,$0.45,0.00,0.00%,,,,382,,
RACE,Ferrari N.V. Common Shares,$484.25,5.13,1.071%,117371161037.00,Italy,2015,306355,Consumer Discretionary,Auto Manufacturing
RADX,Radiopharm Theranostics Limited American Depositary Shares,$4.975,0.135,2.789%,10810479761.00,Australia,,24944,,
RAIL,FreightCar America Inc. Common Stock,$8.25,0.03,0.365%,157082558.00,United States,2005,50978,Industrials,Railroads
RAIN,Rain Enhancement Technologies Holdco Inc. Class A Common Stock,$3.62,-0.04,-1.093%,27463177.00,United States,,5588,Technology,Industrial Machinery/Components
RAINW,Rain Enhancement Technologies Holdco Inc. Warrants,$0.1654,0.00,0.00%,1254809.00,United States,,72,Technology,Industrial Machinery/Components
RAMP,LiveRamp Holdings Inc. Common Stock,$33.505,0.125,0.374%,2177549756.00,United States,2018,156737,Technology,EDP Services
RAND,Rand Capital Corporation Common Stock,$15.1715,0.0413,0.273%,45056533.00,United States,,3848,Finance,Finance: Consumer Services
RANG,Range Capital Acquisition Corp. Ordinary Shares,$10.45,0.00,0.00%,0.00,United States,2025,1,,
RANGR,Range Capital Acquisition Corp. Rights,$0.24,0.02,9.091%,0.00,United States,2025,5765,,
RANGU,Range Capital Acquisition Corp. Units,$10.70,0.27,2.589%,0.00,United States,2024,300,,
RANI,Rani Therapeutics Holdings Inc. Class A Common Stock,$0.6015,0.0274,4.773%,34611576.00,United States,2021,388262,Health Care,Biotechnology: Pharmaceutical Preparations
RAPP,Rapport Therapeutics Inc. Common Stock,$13.13,0.42,3.304%,479212897.00,United States,2024,63626,Health Care,Biotechnology: Pharmaceutical Preparations
RAPT,RAPT Therapeutics Inc. Common Stock,$1.18,-0.02,-1.667%,156100649.00,United States,2019,308283,Health Care,Biotechnology: Pharmaceutical Preparations
RARE,Ultragenyx Pharmaceutical Inc. Common Stock,$37.505,0.465,1.255%,3545799023.00,United States,2014,329591,Health Care,Biotechnology: Pharmaceutical Preparations
RAVE,Rave Restaurant Group Inc. Common Stock,$2.55,-0.06,-2.299%,36239493.00,United States,,36440,Consumer Discretionary,Food Distributors
RAY,Raytech Holding Limited Ordinary Shares,$1.21,0.01,0.833%,21311830.00,Hong Kong,2024,154317,Consumer Discretionary,Consumer Electronics/Appliances
RAYA,Erayak Power Solution Group Inc. Class A Ordinary Shares,$1.97,0.125,6.775%,99658823.00,China,2022,79898,Consumer Discretionary,Metal Fabrications
RBA,RB Global Inc. Common Stock,$105.75,-0.41,-0.386%,19706827001.00,Canada,,459073,Consumer Discretionary,Business Services
RBB,RBB Bancorp Common Stock,$17.43,0.05,0.288%,309205742.00,United States,2017,22208,Finance,Major Banks
RBBN,Ribbon Communications Inc. Common Stock,$3.984,0.014,0.353%,703352834.00,United States,,453052,Technology,EDP Services
RBC,RBC Bearings Incorporated Common Stock,$382.52,1.30,0.341%,12040986746.00,United States,2022,68926,Industrials,Metal Fabrications
RBCAA,Republic Bancorp Inc. Class A Common Stock,$70.87,1.23,1.766%,1383724348.00,United States,1998,35719,Finance,Major Banks
RBKB,Rhinebeck Bancorp Inc. Common Stock,$11.60,0.04,0.346%,128741486.00,United States,2019,1707,Finance,Banks
RBLX,Roblox Corporation Class A Common Stock,$93.4608,0.0408,0.044%,63392994801.00,United States,2021,4582784,Technology,Computer Software: Prepackaged Software
RBNE,Robin Energy Ltd. Common Stock,$2.84,-0.0039,-0.137%,6778319.00,Cyprus,,3747,Consumer Discretionary,Marine Transportation
RBOT,Vicarious Surgical Inc. Class A Common Stock,$7.9599,0.0899,1.142%,47217999.00,Hong Kong,2020,5532,Health Care,Industrial Specialties
RBRK,Rubrik Inc. Class A Common Stock,$87.0577,-6.0923,-6.54%,16521690776.00,United States,2024,5196540,Technology,Computer Software: Prepackaged Software
RC,Ready Capital Corporation Common Stock,$4.515,0.115,2.614%,769840130.00,United States,2013,992473,Real Estate,Real Estate Investment Trusts
RC^C,Ready Capital Corporation 6.25% Series C Cumulative Convertible Preferred Stock,$15.37,0.5214,3.511%,,United States,,528,,
RC^E,Ready Capital Corporation 6.50% Series E Cumulative Redeemable Preferred Stock,$15.70,0.02,0.128%,,United States,,4896,,
RCAT,Red Cat Holdings Inc. Common Stock,$8.59,-0.21,-2.386%,780962126.00,United States,,5314478,Technology,Computer Software: Prepackaged Software
RCB,Ready Capital Corporation 6.20% Senior Notes due 2026,$23.90,0.0871,0.366%,4075122725.00,United States,2019,1803,Real Estate,Real Estate Investment Trusts
RCC,Ready Capital Corporation 5.75% Senior Notes due 2026,$24.32,0.00,0.00%,4146735761.00,United States,2021,10257,Real Estate,Real Estate Investment Trusts
RCD,Ready Capital Corporation 9.00% Senior Notes due 2029,$23.18,-0.07,-0.301%,0.00,United States,2024,7660,Real Estate,Real Estate Investment Trusts
RCEL,Avita Medical Inc. Common Stock,$5.90,-0.21,-3.437%,155964482.00,United States,,363944,Health Care,Medical/Dental Instruments
RCG,RENN Fund Inc Common Stock,$2.60,0.01,0.386%,0.00,United States,,3560,Finance,Investment Managers
RCI,Rogers Communication Inc. Common Stock,$27.2389,0.5889,2.21%,14558310735.00,Canada,,788412,Telecommunications,Cable & Other Pay Television Services
RCKT,Rocket Pharmaceuticals Inc. Common Stock,$3.1411,0.1211,4.01%,338415577.00,United States,2015,2286365,Health Care,Biotechnology: Pharmaceutical Preparations
RCKTW,Rocket Pharmaceuticals Inc. Warrant,$0.0354,-0.0028,-7.33%,3813922.00,United States,,1800,Health Care,Biotechnology: Pharmaceutical Preparations
RCKY,Rocky Brands Inc. Common Stock,$23.215,-0.215,-0.918%,173210992.00,United States,1993,13373,Consumer Discretionary,Shoe Manufacturing
RCL,Royal Caribbean Cruises Ltd. Common Stock,$267.475,-6.515,-2.378%,72635610501.00,United States,1993,909085,Consumer Discretionary,Marine Transportation
RCMT,RCM Technologies Inc. Common Stock,$22.87,-0.27,-1.167%,169018105.00,United States,,10633,Consumer Discretionary,Professional Services
RCON,Recon Technology Ltd. Class A Ordinary Shares,$2.04,-0.06,-2.857%,30779436.00,China,2009,2279,Energy,Oilfield Services/Equipment
RCS,PIMCO Strategic Income Fund Inc.,$6.885,0.075,1.101%,0.00,United States,1994,58948,Finance,Investment Managers
RCT,RedCloud Holdings plc Ordinary Shares,$1.63,0.00,0.00%,72089415.00,United Kingdom,2025,23264,Consumer Discretionary,Other Specialty Stores
RCUS,Arcus Biosciences Inc. Common Stock,$10.10,0.25,2.538%,1069439894.00,United States,2018,402712,Health Care,Biotechnology: Pharmaceutical Preparations
RDAC,Rising Dragon Acquisition Corp. Ordinary Shares,$10.2847,0.00,0.00%,0.00,China,2024,4,,
RDACR,Rising Dragon Acquisition Corp. Rights,$0.1717,0.00,0.00%,0.00,China,2024,15,Finance,Blank Checks
RDAGU,Republic Digital Acquisition Company Unit,$10.58,-0.03,-0.283%,0.00,United States,2025,3761,Finance,Blank Checks
RDCM,Radcom Ltd. Ordinary Shares,$13.03,-0.13,-0.988%,207380476.00,Israel,1997,20044,Technology,Computer peripheral equipment
RDDT,Reddit Inc. Class A Common Stock,$115.58,-1.95,-1.659%,21326892335.00,United States,2024,4150020,Technology,EDP Services
RDFN,Redfin Corporation Common Stock,$10.23,0.23,2.30%,1309758961.00,United States,2017,3958042,Finance,Real Estate
RDGT,Ridgetech Inc. Ordinary Shares,$1.117,-0.0069,-0.614%,7432604.00,China,,7698,Consumer Staples,Retail-Drug Stores and Proprietary Stores
RDHL,Redhill Biopharma Ltd. American Depositary Shares,$2.01,-0.04,-1.951%,4606024.00,Israel,,15832,Health Care,Biotechnology: Pharmaceutical Preparations
RDI,Reading International Inc Class A Common Stock,$1.43,0.03,2.143%,32141299.00,United States,,7079,Consumer Discretionary,Movies/Entertainment
RDIB,Reading International Inc Class B Common Stock,$9.45,-0.2889,-2.966%,212402292.00,United States,,951,Consumer Discretionary,Movies/Entertainment
RDN,Radian Group Inc. Common Stock,$33.70,0.29,0.868%,4527059979.00,United States,,303333,Finance,Property-Casualty Insurers
RDNT,RadNet Inc. Common Stock,$59.00,-0.07,-0.119%,4426775782.00,United States,,218570,Health Care,Medical Specialities
RDUS,Radius Recycling Inc. Class A Common Stock,$29.635,0.035,0.118%,835765737.00,United States,,563142,Consumer Discretionary,Industrial Specialties
RDVT,Red Violet Inc. Common Stock ,$43.51,-0.60,-1.36%,607221992.00,United States,,82291,Technology,Computer Software: Prepackaged Software
RDW,Redwire Corporation Common Stock,$17.7799,-2.1801,-10.922%,1370535001.00,United States,2021,2831288,Industrials,Military/Government/Technical
RDWR,Radware Ltd. Ordinary Shares,$24.305,-0.275,-1.119%,1037496209.00,Israel,1999,57929,Consumer Discretionary,Business Services
RDY,Dr. Reddy's Laboratories Ltd Common Stock,$15.875,0.245,1.567%,13246978919.00,India,,707830,Health Care,Biotechnology: Pharmaceutical Preparations
RDZN,Roadzen Inc. Ordinary Shares,$0.98,-0.04,-3.922%,72707166.00,United States,2022,170674,Finance,Specialty Insurers
RDZNW,Roadzen Inc. Warrants,$0.0612,-0.0089,-12.696%,4540488.00,United States,2022,114994,Finance,Specialty Insurers
REAL,The RealReal Inc. Common Stock,$5.84,-0.28,-4.575%,660476721.00,United States,2019,1655952,Consumer Discretionary,Other Specialty Stores
REAX,The Real Brokerage Inc. Common Shares,$4.235,-0.005,-0.118%,869382255.00,Canada,,396485,Finance,Real Estate
REBN,Reborn Coffee Inc. Common Stock,$2.57,0.03,1.181%,13629496.00,United States,2022,54697,Consumer Discretionary,Restaurants
RECT,Rectitude Holdings Ltd Ordinary Shares,$4.63,-0.18,-3.742%,67135000.00,Singapore,2024,1871,Consumer Discretionary,Industrial Machinery/Components
REE,REE Automotive Ltd. Class A Ordinary Shares,$0.7716,0.0006,0.078%,23935751.00,Israel,,67554,Consumer Discretionary,Auto Manufacturing
REFI,Chicago Atlantic Real Estate Finance Inc. Common Stock,$14.20,-0.08,-0.56%,297737889.00,United States,2021,24794,Real Estate,Real Estate Investment Trusts
REFR,Research Frontiers Incorporated Common Stock,$1.9774,-0.0226,-1.13%,66535992.00,United States,,23308,Miscellaneous,Multi-Sector Companies
REG,Regency Centers Corporation Common Stock,$72.66,0.50,0.693%,13189918139.00,United States,1993,447095,Real Estate,Real Estate Investment Trusts
REGCO,Regency Centers Corporation 5.875% Series B Cumulative Redeemable Preferred Stock,$22.06,0.15,0.685%,4004536115.00,United States,,1559,Real Estate,Real Estate Investment Trusts
REGCP,Regency Centers Corporation 6.25% Series A Cumulative Redeemable Preferred Stock,$23.12,0.11,0.478%,4196957162.00,United States,,803,Real Estate,Real Estate Investment Trusts
REGN,Regeneron Pharmaceuticals Inc. Common Stock,$526.001,8.401,1.623%,56789959387.00,United States,1991,611974,Health Care,Biotechnology: Pharmaceutical Preparations
REI,Ring Energy Inc. Common Stock,$0.81,0.028,3.581%,167284851.00,United States,,2769785,Energy,Oil & Gas Production
REKR,Rekor Systems Inc. Common Stock,$1.335,-0.115,-7.931%,157631385.00,United States,,2766564,Telecommunications,Telecommunications Equipment
RELI,Reliance Global Group Inc. Common Stock,$1.40,-0.01,-0.709%,4164873.00,United States,,20564,Finance,Specialty Insurers
RELIW,Reliance Global Group Inc. Series A Warrants,$0.021,-0.0005,-2.326%,62473.00,United States,,200,Finance,Specialty Insurers
RELL,Richardson Electronics Ltd. Common Stock,$9.3995,-0.2305,-2.394%,135117813.00,United States,1983,20964,Technology,Electronic Components
RELX,RELX PLC PLC American Depositary Shares (Each representing One Ordinary Share),$52.9565,-0.0735,-0.139%,97754131479.00,United Kingdom,2015,434892,Consumer Discretionary,Business Services
RELY,Remitly Global Inc. Common Stock,$19.77,-0.54,-2.659%,4030284364.00,United States,2021,1905003,Consumer Discretionary,Business Services
RENB,Renovaro Inc. Common Stock,$0.3737,0.0134,3.719%,64320709.00,United States,,2431975,Health Care,Biotechnology: Pharmaceutical Preparations
RENT,Rent the Runway Inc. Class A Common Stock,$5.96,-1.64,-21.579%,23970452.00,United States,2021,301535,Consumer Discretionary,Other Specialty Stores
REPL,Replimune Group Inc. Common Stock,$10.31,0.13,1.277%,794764393.00,United States,2018,338932,Health Care,Biotechnology: Biological Products (No Diagnostic Substances)
REPX,Riley Exploration Permian Inc. Common Stock,$27.73,0.52,1.911%,610698788.00,United States,1999,68734,Energy,Oil & Gas Production
RERE,ATRenew Inc. American Depositary Shares (every three of which representing two Class A ordinary shares),$2.775,0.085,3.16%,609990335.00,Cayman Islands,2021,629892,Consumer Discretionary,Other Specialty Stores
RES,RPC Inc. Common Stock,$4.985,0.225,4.727%,1099514062.00,United States,,887035,Energy,Oilfield Services/Equipment
RETO,ReTo Eco-Solutions Inc. Class A Shares,$3.54,0.21,6.306%,27130132.00,China,2017,25575,Industrials,Industrial Machinery/Components
REVB,Revelation Biosciences Inc. Common Stock,$0.8314,-0.0336,-3.884%,801300.00,United States,2020,274422,Health Care,Biotechnology: Pharmaceutical Preparations
REVBW,Revelation Biosciences Inc. Warrant,$0.0119,0.0007,6.25%,11469.00,United States,2020,28857,Health Care,Biotechnology: Pharmaceutical Preparations
REVG,REV Group Inc. Common Stock,$44.67,-1.27,-2.764%,2179777669.00,United States,2017,384879,Consumer Discretionary,Auto Manufacturing
REX,REX American Resources Corporation,$44.70,0.91,2.078%,736157997.00,United States,,32334,Industrials,Major Chemicals
REXR,Rexford Industrial Realty Inc. Common Stock,$36.85,0.25,0.683%,8721844019.00,United States,2013,1021257,Real Estate,Real Estate Investment Trusts
REXR^B,Rexford Industrial Realty Inc. 5.875% Series B Cumulative Redeemable Preferred Stock,$23.0199,0.0444,0.193%,,United States,,1427,,
REXR^C,Rexford Industrial Realty Inc. 5.625% Series C Cumulative Redeemable Preferred Stock par value $0.01 per share,$21.63,-0.205,-0.939%,,United States,,6950,,
REYN,Reynolds Consumer Products Inc. Common Stock,$21.93,0.22,1.013%,4612389377.00,United States,2020,295074,Consumer Discretionary,Containers/Packaging
REZI,Resideo Technologies Inc. Common Stock ,$21.685,0.215,1.001%,3220299135.00,United States,2018,359085,Industrials,Wholesale Distributors
RF,Regions Financial Corporation Common Stock,$22.305,0.215,0.973%,20050637085.00,United States,,6436147,Finance,Major Banks
RF^C,Regions Financial Corporation Depositary Shares each Representing a 1/40th Interest in a  Share of 5.700% Fixed-to-Floating Rate Non-Cumulative  Perpetual Preferred Stock Series C,$23.9671,0.0671,0.281%,,United States,,13966,,
RF^E,Regions Financial Corporation Depositary Shares Each Representing a 1/40th Interest in a Share of 4.45% Non-Cumulative Perpetual Preferred Stock Series E,$17.29,0.01,0.058%,,United States,,10400,,
RF^F,Regions Financial Corporation Depositary Shares Each Representing a 1/40th Interest in a Share of Non-Cumulative Perpetual Preferred Stock Series F,$25.05,-0.02,-0.08%,,United States,,22003,,
RFAI,RF Acquisition Corp II Ordinary Shares,$10.51,0.00,0.00%,0.00,Singapore,2024,41,,
RFAIR,RF Acquisition Corp II Right,$0.0783,0.0097,14.14%,0.00,Singapore,2024,1747,Technology,Computer Software: Prepackaged Software
RFI,Cohen & Steers Total Return Realty Fund Inc. Common Stock,$12.03,-0.05,-0.414%,591137695.00,United States,1993,28743,Finance,Investment Managers
RFIL,RF Industries Ltd. Common Stock,$4.23,0.09,2.174%,45133580.00,United States,,8097,Technology,Electrical Products
RFL,Rafael Holdings Inc. Class B Common Stock,$2.86,0.61,27.111%,91648700.00,United States,2018,2832755,Finance,Real Estate
RFM,RiverNorth Flexible Municipal Income Fund Inc. Common Stock,$14.072,0.002,0.014%,86046044.00,,2020,45113,Finance,Finance/Investors Services
RFMZ,RiverNorth Flexible Municipal Income Fund II Inc. Common Stock,$12.66,-0.035,-0.276%,308293231.00,,2021,74869,Finance,Trusts Except Educational Religious and Charitable
RGA,Reinsurance Group of America Incorporated Common Stock,$202.12,-1.08,-0.531%,13357296459.00,United States,,84220,Finance,Life Insurance
RGC,Regencell Bioscience Holdings Limited Ordinary Shares,$588.9491,-51.0009,-7.97%,7663915719.00,Hong Kong,2021,33518,Health Care, Medicinal Chemicals and Botanical Products 
RGCO,RGC Resources Inc. Common Stock,$20.51,0.21,1.034%,211490772.00,United States,,3130,Utilities,Oil & Gas Production
RGEN,Repligen Corporation Common Stock,$132.175,0.495,0.376%,7426001243.00,United States,1986,309296,Health Care,Biotechnology: Biological Products (No Diagnostic Substances)
RGLD,Royal Gold Inc. Common Stock,$174.245,-2.525,-1.428%,11468195346.00,United States,,173412,Industrials,Precious Metals
RGLS,Regulus Therapeutics Inc. Common Stock,$8.275,-0.025,-0.301%,572912086.00,United States,2012,514348,Health Care,Biotechnology: Pharmaceutical Preparations
RGNX,REGENXBIO Inc. Common Stock,$9.72,0.19,1.994%,487558621.00,United States,2015,545036,Health Care,Biotechnology: Biological Products (No Diagnostic Substances)
RGP,Resources Connection Inc. Common Stock,$5.475,0.155,2.914%,181054286.00,United States,,68689,Consumer Discretionary,Business Services
RGR,Sturm Ruger & Company Inc. Common Stock,$37.915,0.655,1.758%,627681384.00,United States,,96492,Industrials,Ordnance And Accessories
RGS,Regis Corporation Common Stock,$22.51,-0.34,-1.488%,54833932.00,United States,1991,5188,Consumer Discretionary,Other Consumer Services
RGT,Royce Global Trust Inc. Common Stock,$11.7899,0.0699,0.596%,73886631.00,,2013,6312,Finance,Trusts Except Educational Religious and Charitable
