Symbol,Name,Last Sale,Net Change,% Change,Market Cap,Country,IPO Year,Volume,Sector,Industry
DKNG,DraftKings Inc. Class A Common Stock,$37.049,0.849,2.345%,18386886343.00,United States,2019,7221906,Consumer Discretionary,Services-Misc. Amusement & Recreation
DKS,Dick's Sporting Goods Inc Common Stock,$182.59,0.23,0.126%,14580849707.00,United States,2002,350862,Consumer Discretionary,Other Specialty Stores
DLB,Dolby Laboratories Common Stock,$76.16,0.66,0.874%,7316400878.00,United States,2005,146986,Miscellaneous,Multi-Sector Companies
DLHC,DLH Holdings Corp.,$5.59,0.12,2.194%,80420356.00,United States,,36125,Consumer Discretionary,Professional Services
DLNG,Dynagas LNG Partners LP Common Units,$3.67,-0.01,-0.272%,134607460.00,Greece,,13603,Consumer Discretionary,Marine Transportation
DLNG^A,Dynagas LNG Partners LP 9.00% Series A Cumulative Redeemable Preferred Units,$25.4105,0.1705,0.676%,,Greece,,2570,,
DLNG^B,Dynagas LNG Partners LP 8.75% Series B Fixed to Floating Rate Cumulative Redeemable Perpetual Preferred Units liquidation preference $25.00 per Uni,$25.21,0.0098,0.039%,,Greece,,211,,
DLO,DLocal Limited Class A Common Shares,$10.21,-0.35,-3.314%,2914701139.00,Uruguay,2021,387987,Consumer Discretionary,Business Services
DLPN,Dolphin Entertainment Inc. Common Stock,$1.18,0.01,0.855%,13178380.00,United States,,28803,Consumer Discretionary,Other Consumer Services
DLR,Digital Realty Trust Inc. Common Stock,$176.66,-0.02,-0.011%,59497584447.00,United States,2004,853373,Real Estate,Real Estate Investment Trusts
DLR^J,Digital Realty Trust Inc. 5.250% Series J Cumulative Redeemable Preferred Stock,$21.30,0.06,0.282%,,United States,,3817,,
DLR^K,Digital Realty Trust Inc. 5.850% Series K Cumulative Redeemable Preferred Stock par value $0.01 per share,$23.4912,-0.0088,-0.037%,,United States,,6704,,
DLR^L,Digital Realty Trust Inc. 5.200% Series L Cumulative Redeemable Preferred Stock,$20.37,-0.03,-0.147%,,United States,,13318,,
DLTH,Duluth Holdings Inc. Class B Common Stock,$2.14,0.09,4.39%,80418760.00,United States,2015,24005,Consumer Discretionary,Clothing/Shoe/Accessory Stores
DLTR,Dollar Tree Inc. Common Stock,$93.48,-0.37,-0.394%,19508885067.00,United States,1995,1399774,Consumer Discretionary,Department/Specialty Retail Stores
DLX,Deluxe Corporation Common Stock,$15.76,0.41,2.671%,705099878.00,United States,,200772,Consumer Discretionary,Publishing
DLY,DoubleLine Yield Opportunities Fund Common Shares of Beneficial Interest,$15.67,0.04,0.256%,751310357.00,United States,2020,130748,Finance,Investment Managers
DMA,Destra Multi-Alternative Fund Common Stock,$8.7099,0.0899,1.043%,0.00,,2022,7942,Finance,Trusts Except Educational Religious and Charitable
DMAA,Drugs Made In America Acquisition Corp. Ordinary Shares,$10.17,0.01,0.098%,0.00,United States,2025,90355,,
DMAAR,Drugs Made In America Acquisition Corp. Rights,$0.13,0.00,0.00%,0.00,United States,2025,21,Finance,Blank Checks
DMAAU,Drugs Made In America Acquisition Corp. Units,$10.29,0.00,0.00%,0.00,United States,2025,122,,
DMAC,DiaMedica Therapeutics Inc. Common Stock,$4.15,0.07,1.716%,177966380.00,United States,2018,46582,Health Care,Biotechnology: Pharmaceutical Preparations
DMB,BNY Mellon Municipal Bond Infrastructure Fund Inc. Common Stock,$10.0124,0.0424,0.425%,0.00,,2013,80667,Finance,Trusts Except Educational Religious and Charitable
DMF,BNY Mellon Municipal Income Inc. Common Stock,$6.87,-0.05,-0.723%,427938167.00,United States,1988,182096,Finance,Finance/Investors Services
DMLP,Dorchester Minerals L.P. Common Units Representing Limited Partnership Interests,$27.9135,0.2635,0.953%,1321418279.00,United States,,22677,Energy,Oil & Gas Production
DMO,Western Asset Mortgage Opportunity Fund Inc. Common Stock,$11.83,-0.01,-0.084%,0.00,United States,2010,25729,Finance,Trusts Except Educational Religious and Charitable
DMRC,Digimarc Corporation Common Stock,$13.625,0.225,1.679%,293646014.00,United States,,72181,Technology,EDP Services
DMYY,dMY Squared Technology Group Inc. Class A Common Stock,$14.55,-0.16,-1.088%,0.00,,2022,31184,Finance,Blank Checks
DNA,Ginkgo Bioworks Holdings Inc. Class A Common Stock,$8.2775,0.4375,5.58%,484497612.00,United States,2021,733647,Health Care,Biotechnology: Biological Products (No Diagnostic Substances)
DNB,Dun & Bradstreet Holdings Inc. Common Stock,$9.055,0.035,0.388%,4042374527.00,United States,2020,6740068,Finance,Finance: Consumer Services
DNLI,Denali Therapeutics Inc. Common Stock,$15.47,0.825,5.633%,2247424346.00,United States,2017,1156790,Health Care,Biotechnology: Biological Products (No Diagnostic Substances)
DNN,Denison Mines Corp Ordinary Shares (Canada),$1.58,-0.14,-8.14%,1416224375.00,Canada,,143016059,Basic Materials,Other Metals and Minerals
DNOW,DNOW Inc. Common Stock,$14.91,0.10,0.675%,1574021415.00,United States,2014,208086,Industrials,Metal Fabrications
DNP,DNP Select Income Fund Inc. Common Stock,$9.735,0.035,0.361%,0.00,United States,1987,602057,Finance,Investment Managers
DNTH,Dianthus Therapeutics Inc. Common Stock,$18.81,0.62,3.408%,604929261.00,United States,2018,244180,Health Care,Biotechnology: Pharmaceutical Preparations
DNUT,Krispy Kreme Inc. Common Stock,$2.94,-0.05,-1.672%,502152000.00,United States,2021,1415206,Consumer Staples,Food Chains
DOC,Healthpeak Properties Inc. Common Stock,$17.545,0.275,1.592%,12189074800.00,United States,,3034648,Real Estate,Real Estate Investment Trusts
DOCN,DigitalOcean Holdings Inc. Common Stock,$29.685,0.725,2.503%,2702330279.00,United States,2021,553606,Technology,Computer Software: Programming Data Processing
DOCS,Doximity Inc. Class A Common Stock,$58.10,0.04,0.069%,10912699489.00,United States,2021,901314,Technology,EDP Services
DOCU,DocuSign Inc. Common Stock,$77.60,-0.98,-1.247%,15680071107.00,United States,1989,3378223,Technology,Computer Software: Prepackaged Software
DOGZ,Dogness (International) Corporation Class A Common Stock,$25.60,-0.86,-3.25%,325904845.00,China,2017,228628,Consumer Discretionary,Miscellaneous manufacturing industries
DOLE,Dole plc Ordinary Shares,$13.77,-0.03,-0.217%,1310050728.00,Ireland,2021,234744,Consumer Staples,Farming/Seeds/Milling
DOMH,Dominari Holdings Inc. Common Stock,$5.41,0.14,2.657%,79548883.00,United States,,138990,Health Care,Biotechnology: Pharmaceutical Preparations
DOMO,Domo Inc. Class B Common Stock,$13.675,-0.575,-4.035%,550214555.00,United States,2018,303001,Technology,Computer Software: Prepackaged Software
DOOO,BRP Inc. (Recreational Products) Common Subordinate Voting Shares,$48.70,1.52,3.222%,3561530056.00,Canada,,107835,Consumer Discretionary,Industrial Specialties
DORM,Dorman Products Inc. Common Stock,$129.06,1.45,1.136%,3937772116.00,United States,,55364,Consumer Discretionary,Auto Parts:O.E.M.
DOUG,Douglas Elliman Inc. Common Stock,$2.62,-0.01,-0.38%,232493136.00,United States,2021,170059,Finance,Real Estate
DOV,Dover Corporation Common Stock,$181.80,1.07,0.592%,24925573921.00,United States,,212101,Industrials,Industrial Machinery/Components
DOW,Dow Inc. Common Stock ,$30.725,1.335,4.542%,21718326900.00,United States,2019,6409586,Industrials,Major Chemicals
DOX,Amdocs Limited Ordinary Shares,$93.045,0.655,0.709%,10503902527.00,Guernsey,,273266,Technology,EDP Services
DOYU,DouYu International Holdings Limited ADS,$6.60,-0.15,-2.222%,199180469.00,China,2019,28707,Technology,Computer Software: Programming Data Processing
DPG,Duff & Phelps Utility and Infrastructure Fund Inc.,$12.19,0.00,0.00%,0.00,United States,2011,65252,Finance,Trusts Except Educational Religious and Charitable
DPRO,Draganfly Inc. Common Shares,$3.85,0.51,15.269%,20962453.00,Canada,,4529861,Industrials,Aerospace
DPZ,Domino's Pizza Inc Common Stock,$457.025,-10.925,-2.335%,15649211026.00,United States,2004,302829,Consumer Discretionary,Food Distributors
DQ,DAQO New Energy Corp. American Depositary Shares each representing five ordinary shares,$14.675,0.065,0.445%,984057293.00,China,2010,155821,Technology,Semiconductors
DRCT,Direct Digital Holdings Inc. Class A Common Stock,$0.5306,-0.0289,-5.165%,10034431.00,United States,2022,160496,Consumer Discretionary,Advertising
DRD,DRDGOLD Limited American Depositary Shares,$13.83,-0.41,-2.879%,1195726186.00,South Africa,,303372,Basic Materials,Precious Metals
DRDB,Roman DBDR Acquisition Corp. II Ordinary shares,$10.34,-0.01,-0.097%,0.00,United States,2025,58986,,
DRDBU,Roman DBDR Acquisition Corp. II Unit,$10.58,0.02,0.189%,0.00,United States,2024,655,,
DRDBW,Roman DBDR Acquisition Corp. II Warrants,$0.575,0.095,19.792%,0.00,United States,2025,192920,,
DRH,Diamondrock Hospitality Company Common Stock,$7.88,0.12,1.546%,1625732618.00,United States,2005,1298473,Real Estate,Real Estate Investment Trusts
DRH^A,Diamondrock Hospitality Company 8.250% Series A Cumulative Redeemable Preferred Stock,$25.2915,-0.0533,-0.21%,,United States,,1536,,
DRI,Darden Restaurants Inc. Common Stock,$216.26,-3.44,-1.566%,25308095960.00,United States,,361387,Consumer Discretionary,Restaurants
DRIO,DarioHealth Corp. Common Stock,$0.7203,0.0003,0.042%,31656770.00,Israel,,267989,Health Care,Medical/Dental Instruments
DRMA,Dermata Therapeutics Inc. Common Stock,$0.7668,0.009,1.188%,4890741.00,United States,2021,63993,Health Care,Biotechnology: Pharmaceutical Preparations
DRMAW,Dermata Therapeutics Inc. Warrant,$0.0196,-0.0043,-17.992%,125011.00,United States,2021,6378,Health Care,Biotechnology: Pharmaceutical Preparations
DRRX,DURECT Corporation Common Stock,$0.5401,-0.0127,-2.297%,16766098.00,United States,2000,17820,Health Care,Biotechnology: Pharmaceutical Preparations
DRS,Leonardo DRS Inc. Common Stock,$43.395,-1.145,-2.571%,11545205251.00,Israel,,434549,Industrials,Industrial Machinery/Components
DRTS,Alpha Tau Medical Ltd. Ordinary Shares,$3.10,-0.025,-0.80%,218179767.00,Israel,,36569,Health Care,Medical/Dental Instruments
DRTSW,Alpha Tau Medical Ltd. Warrant,$0.2586,0.0082,3.275%,18200415.00,Israel,,13658,Health Care,Medical/Dental Instruments
DRUG,Bright Minds Biosciences Inc. Common Stock,$28.23,0.35,1.255%,197299159.00,Canada,,13735,Health Care,Biotechnology: Pharmaceutical Preparations
DRVN,Driven Brands Holdings Inc. Common Stock,$17.94,-0.29,-1.591%,2947099940.00,United States,2021,223531,Consumer Discretionary,Automotive Aftermarket
DSGN,Design Therapeutics Inc. Common Stock,$4.03,0.12,3.069%,228777772.00,United States,2021,26328,Health Care,Biotechnology: Pharmaceutical Preparations
DSGR,Distribution Solutions Group Inc. Common Stock,$27.965,0.395,1.433%,1298648206.00,United States,,17752,Consumer Discretionary,Industrial Specialties
DSGX,Descartes Systems Group Inc. (The) Common Stock,$99.47,-1.01,-1.005%,8493757425.00,Canada,,267621,Technology,Computer Software: Prepackaged Software
DSL,DoubleLine Income Solutions Fund Common Shares of Beneficial Interests,$12.245,-0.005,-0.041%,1248951159.00,United States,2013,162178,Finance,Trusts Except Educational Religious and Charitable
DSM,BNY Mellon Strategic Municipal Bond Fund Inc. Common Stock,$5.53,-0.02,-0.36%,0.00,United States,1989,87270,Finance,Investment Managers
DSP,Viant Technology Inc. Class A Common Stock,$13.38,-0.79,-5.575%,837140894.00,United States,2021,173345,Technology,Computer Software: Programming Data Processing
DSS,DSS Inc. Common Stock,$0.93,-0.009,-0.958%,8456042.00,United States,,6687,Consumer Discretionary,Containers/Packaging
DSU,Blackrock Debt Strategies Fund Inc. Common Stock,$10.495,-0.055,-0.521%,0.00,United States,1998,150410,Finance,Finance Companies
DSWL,Deswell Industries Inc. Common Shares,$2.345,-0.005,-0.213%,37368135.00,Macau,1995,793,Industrials,Plastic Products
DSX,Diana Shipping inc. common stock,$1.55,0.02,1.307%,179440185.00,Greece,2005,125294,Consumer Discretionary,Marine Transportation
DSX^B,Diana Shipping Inc. Perpetual Preferred Shares Series B (Marshall Islands),$26.35,0.04,0.152%,,Greece,,1408,,
DSY,Big Tree Cloud Holdings Limited Ordinary Shares,$1.35,-0.0095,-0.699%,77058737.00,China,,1447,Consumer Discretionary,Containers/Packaging
DSYWW,Big Tree Cloud Holdings Limited Warrants,$0.0191,0.0024,14.371%,1090238.00,China,,36654,Consumer Discretionary,Containers/Packaging
DT,Dynatrace Inc. Common Stock,$53.995,-0.215,-0.397%,16180509082.00,United States,2019,973474,Technology,Computer Software: Prepackaged Software
DTB,DTE Energy Company 2020 Series G 4.375% Junior Subordinated Debentures due 2080,$17.30,0.00,0.00%,3590021299.00,United States,2020,13759,Utilities,Electric Utilities: Central
DTCK,Davis Commodities Limited Ordinary Shares,$0.70,-0.0002,-0.029%,17150438.00,Singapore,2023,266831,Industrials,Farming/Seeds/Milling
DTE,DTE Energy Company Common Stock,$135.04,1.14,0.851%,28022917697.00,United States,,473237,Utilities,Electric Utilities: Central
DTF,DTF Tax-Free Income 2028 Term Fund Inc. Common Stock,$11.2294,0.0244,0.218%,78937820.00,United States,1991,401,Finance,Investment Managers
DTG,DTE Energy Company 2021 Series E 4.375% Junior Subordinated Debentures,$17.10,0.04,0.234%,3548518162.00,United States,2021,8790,Utilities,Electric Utilities: Central
DTI,Drilling Tools International Corporation Common Stock,$3.17,0.07,2.258%,112828976.00,United States,2021,26800,Industrials,Metal Fabrications
DTIL,Precision BioSciences Inc. Common Stock,$5.20,-0.10,-1.887%,57658817.00,United States,2019,54885,Health Care,Biotechnology: Biological Products (No Diagnostic Substances)
DTM,DT Midstream Inc. Common Stock ,$104.075,-1.665,-1.575%,10573050645.00,United States,2021,388243,Utilities,Natural Gas Distribution
DTSS,Datasea Inc. Common Stock,$2.36,-0.01,-0.422%,18063136.00,China,,50850,Technology,Computer Software: Prepackaged Software
DTST,Data Storage Corporation Common Stock,$3.7705,0.0205,0.547%,26920967.00,United States,,20283,Technology,EDP Services
DTSTW,Data Storage Corporation Warrant,$0.271,-0.0185,-6.39%,1934911.00,United States,,3024,Technology,EDP Services
DTW,DTE Energy Company 2017 Series E 5.25% Junior Subordinated Debentures due 2077,$21.38,-0.0072,-0.034%,4436685281.00,United States,2017,9360,Utilities,Electric Utilities: Central
DUK,Duke Energy Corporation (Holding Company) Common Stock,$116.51,1.04,0.901%,90558225537.00,United States,,952043,Utilities,Power Generation
DUK^A,Duke Energy Corporation Depositary Shares each representing a 1/1000th interest in a share of 5.75% Series A Cumulative Redeemable Perpetual Preferred Stock,$24.74,-0.02,-0.081%,,United States,,25070,,
DUKB,Duke Energy Corporation 5.625% Junior Subordinated Debentures due 2078,$24.60,-0.02,-0.081%,19120524832.00,United States,2018,24466,Utilities,Power Generation
DUO,Fangdd Network Group Ltd. Class A Ordinary Shares,$2.5809,-0.1791,-6.489%,10077292.00,China,2019,279256,Finance,Real Estate
DUOL,Duolingo Inc. Class A Common Stock,$481.28,-16.65,-3.344%,21876219034.00,United States,2021,675115,Technology,Computer Software: Prepackaged Software
DUOT,Duos Technologies Group Inc. Common Stock,$8.00,0.02,0.251%,93231240.00,United States,,97716,Technology,Computer Software: Prepackaged Software
DV,DoubleVerify Holdings Inc. Common Stock,$14.875,0.235,1.605%,2417226190.00,United States,2021,1116605,Technology,Computer Software: Programming Data Processing
DVA,DaVita Inc. Common Stock,$139.70,1.92,1.394%,10547350000.00,United States,,289736,Health Care,Misc Health and Biotechnology Services
DVAX,Dynavax Technologies Corporation Common Stock,$10.39,0.11,1.07%,1247637954.00,United States,2004,662218,Health Care,Biotechnology: Pharmaceutical Preparations
DVLT,Datavault AI Inc. Common Stock,$0.803,-0.0165,-2.013%,53017425.00,United States,2018,197449,Technology,Semiconductors
DVN,Devon Energy Corporation Common Stock,$33.515,0.865,2.649%,21519981500.00,United States,1985,3397903,Energy,Oil & Gas Production
DVS,Dolly Varden Silver Corporation Common Shares,$3.51,-0.16,-4.36%,279459345.00,,2025,640621,,
DWSN,Dawson Geophysical Company Common Stock,$1.35,0.00,0.00%,41828619.00,United States,,264,Energy,Oil & Gas Production
DWTX,Dogwood Therapeutics Inc. Common Stock,$4.97,0.04,0.811%,9498306.00,United States,2020,19356,Health Care,Biotechnology: Pharmaceutical Preparations
DX,Dynex Capital Inc. Common Stock,$12.30,0.09,0.737%,1295576712.00,United States,,1501568,Real Estate,Real Estate Investment Trusts
DX^C,Dynex Capital Inc. 6.900% Series C Fixed-to-Floating Rate Cumulative Redeemable Preferred Stock,$25.5462,-0.0538,-0.21%,,United States,,570,,
DXC,DXC Technology Company Common Stock ,$15.86,0.26,1.667%,2874883581.00,United States,,779822,Technology,EDP Services
DXCM,DexCom Inc. Common Stock,$84.625,-1.055,-1.231%,33182097272.00,United States,2005,770639,Health Care,Medical/Dental Instruments
DXF,Eason Technology Limited American Depositary Shares (each representing sixty-thousand (60000) Ordinary Shares),$6.65,0.23,3.583%,1658936.00,,,26283,Finance,Finance: Consumer Services
DXLG,Destination XL Group Inc. Common Stock,$1.175,-0.015,-1.261%,63232630.00,United States,,68016,Consumer Discretionary,Clothing/Shoe/Accessory Stores
DXPE,DXP Enterprises Inc. Common Stock,$80.7271,0.1271,0.158%,1266954518.00,United States,,60275,Industrials,Industrial Machinery/Components
DXR,Daxor Corporation Common Stock,$8.6057,-0.6442,-6.964%,41651588.00,United States,,2390,Health Care,Medical/Dental Instruments
DXST,Decent Holding Inc Class A Ordinary Shares,$1.28,-0.03,-2.29%,20800000.00,China,2025,10747,Industrials,Miscellaneous
DXYZ,Destiny Tech100 Inc. Common Stock,$40.93,-1.82,-4.257%,0.00,,2024,395575,,
DY,Dycom Industries Inc. Common Stock,$232.71,-5.53,-2.321%,6731098818.00,United States,,202369,Industrials,Water Sewer Pipeline Comm & Power Line Construction
DYAI,Dyadic International Inc. Common Stock,$1.00,0.0177,1.802%,30090661.00,United States,,5563,Health Care,Biotechnology: Biological Products (No Diagnostic Substances)
DYCQ,DT Cloud Acquisition Corporation Ordinary Shares,$10.80,0.00,0.00%,0.00,United Kingdom,2024,32,,
DYCQR,DT Cloud Acquisition Corporation Right,$0.16,0.00,0.00%,0.00,United Kingdom,2024,30000,,
DYN,Dyne Therapeutics Inc. Common Stock,$14.97,0.57,3.958%,1701588673.00,United States,2020,1241002,Health Care,Biotechnology: Pharmaceutical Preparations
DYNX,Dynamix Corporation Class A Ordinary Shares,$10.1395,0.0395,0.391%,0.00,United States,2024,127,,
DYNXU,Dynamix Corporation Unit,$10.28,0.01,0.097%,0.00,United States,2024,755,,
DYNXW,Dynamix Corporation Warrant,$0.35,0.00,0.00%,0.00,United States,2024,647,,
E,ENI S.p.A. Common Stock,$31.20,0.56,1.828%,51238052206.00,Italy,,182121,Energy,Oil & Gas Production
EA,Electronic Arts Inc. Common Stock,$147.125,0.205,0.14%,36893943631.00,United States,,1911715,Technology,Computer Software: Prepackaged Software
EAD,Allspring Income Opportunities Fund Common Shares,$6.90,0.00,0.00%,0.00,United States,2003,82801,Finance,Finance/Investors Services
EAF,GrafTech International Ltd. Common Stock,$1.265,-0.035,-2.692%,326512891.00,United States,2018,1533088,Energy,Industrial Machinery/Components
EAI,Entergy Arkansas LLC First Mortgage Bonds 4.875% Series Due September 1 2066,$20.55,-0.01,-0.049%,8852407940.00,United States,2016,7867,Utilities,Electric Utilities: Central
EARN,Ellington Credit Company Common Shares of Beneficial Interest,$5.725,-0.005,-0.087%,215026391.00,United States,2013,143343,Real Estate,Real Estate Investment Trusts
EAT,Brinker International Inc. Common Stock,$167.31,-6.14,-3.54%,7437122408.00,United States,,734490,Consumer Discretionary,Restaurants
EB,Eventbrite Inc. Class A Common Stock,$2.595,-0.035,-1.331%,248832277.00,United States,2018,160290,Technology,Computer Software: Programming Data Processing
EBAY,eBay Inc. Common Stock,$79.105,-0.26,-0.328%,36467405000.00,United States,1998,2715335,Consumer Discretionary,Business Services
EBC,Eastern Bankshares Inc. Common Stock,$15.335,0.215,1.422%,3237064337.00,United States,2020,366171,Finance,Savings Institutions
EBF,Ennis Inc. Common Stock,$18.86,0.21,1.126%,491363748.00,United States,,57077,Consumer Discretionary,Office Equipment/Supplies/Services
EBMT,Eagle Bancorp Montana Inc. Common Stock,$16.73,0.07,0.42%,133039921.00,United States,2010,14528,Finance,Major Banks
EBON,Ebang International Holdings Inc. Class A Ordinary Shares,$3.665,-0.0167,-0.454%,23983533.00,China,2020,4353,Technology,Semiconductors
EBR,Centrais Electricas Brasileiras S A American Depositary Shares (Each representing one Common Share),$7.435,0.085,1.156%,16675803804.00,Brazil,2016,1123987,Utilities,Electric Utilities: Central
EBS,Emergent BioSolutions Inc. Common Stock,$6.78,0.29,4.468%,368003667.00,United States,2006,537654,Health Care,Biotechnology: Pharmaceutical Preparations
EBTC,Enterprise Bancorp Inc Common Stock,$40.96,0.42,1.036%,512343491.00,United States,,7432,Finance,Major Banks
EC,Ecopetrol S.A. American Depositary Shares,$9.045,0.115,1.288%,18595025178.00,Colombia,,1368586,Energy,Oil & Gas Production
ECAT,BlackRock ESG Capital Allocation Term Trust Common Shares of Beneficial Interest,$16.2208,0.1208,0.75%,1754036208.00,United States,2021,134072,Finance,Trusts Except Educational Religious and Charitable
ECBK,ECB Bancorp Inc. Common Stock,$15.925,0.275,1.757%,143765820.00,United States,2022,6041,Finance,Banks
ECC           ,Eagle Point Credit Company Inc. Common Stock,$7.78,-0.14,-1.768%,471954437.00,United States,2014,1362758,Finance,Trusts Except Educational Religious and Charitable
ECC^D,Eagle Point Credit Company Inc. 6.75% Series D Preferred Stock,$19.2178,-0.0842,-0.436%,,United States,,7015,,
ECCC,Eagle Point Credit Company Inc. 6.50% Series C Term Preferred Stock due 2031,$22.4901,-0.4299,-1.876%,1364306231.00,United States,,1007,Finance,Trusts Except Educational Religious and Charitable
ECCF,Eagle Point Credit Company Inc. 8.00% Series F Term Preferred Stock due 2029,$24.94,-0.03,-0.12%,27151500330.00,United States,,6370,,
ECCU,Eagle Point Credit Company Inc. 7.75% Notes due 2030,$24.85,-0.0417,-0.168%,0.00,United States,2024,3699,,
ECCV,Eagle Point Credit Company Inc. 5.375% Notes due 2029,$23.18,0.03,0.13%,1406157306.00,United States,2022,228,Finance,Trusts Except Educational Religious and Charitable
ECCW,Eagle Point Credit Company Inc. 6.75% Notes due 2031,$23.68,0.11,0.467%,1436488568.00,United States,2021,269,Finance,Trusts Except Educational Religious and Charitable
ECCX,Eagle Point Credit Company Inc. 6.6875% Notes due 2028,$24.77,0.02,0.081%,1502610719.00,United States,2022,1944,Finance,Trusts Except Educational Religious and Charitable
ECDA,ECD Automotive Design Inc. Common Stock,$0.323,0.0002,0.062%,11429569.00,United States,2022,323150,Consumer Discretionary,Auto Manufacturing
ECDAW,ECD Automotive Design Inc. Warrant ,$0.0125,-0.0049,-28.161%,442321.00,United States,2022,80541,Consumer Discretionary,Auto Manufacturing
ECF,Ellsworth Growth and Income Fund Ltd.,$10.09,0.10,1.001%,0.00,United States,1986,35846,Finance,Finance/Investors Services
ECF^A,Ellsworth Growth and Income Fund Ltd. 5.25% Series A Cumulative Preferred Shares (Liquidation Preference $25.00 per share),$21.8441,0.00,0.00%,,United States,,12,,
ECG,Everus Construction Group Inc. Common Stock,$59.395,-1.635,-2.679%,3029120113.00,United States,2024,128999,Consumer Discretionary,Homebuilding
ECL,Ecolab Inc. Common Stock,$268.53,2.18,0.818%,76131643312.00,United States,,586197,Consumer Discretionary,Package Goods/Cosmetics
ECO,Okeanis Eco Tankers Corp. Common Stock,$21.775,-0.105,-0.48%,701026702.00,,,50528,Consumer Discretionary,Marine Transportation
ECOR,electroCore Inc. Common Stock,$5.56,-0.02,-0.358%,41258636.00,United States,2018,51854,Health Care,Biotechnology: Electromedical & Electrotherapeutic Apparatus
ECPG,Encore Capital Group Inc Common Stock,$38.84,0.49,1.278%,906882928.00,United States,,46181,Finance,Finance Companies
ECVT,Ecovyst Inc. Common Stock,$8.105,0.085,1.06%,951531134.00,United States,2017,493574,Industrials,Major Chemicals
ECX,ECARX Holdings Inc. Class A Ordinary shares,$1.61,-0.11,-6.395%,556625342.00,China,,582727,Technology,EDP Services
ECXWW,ECARX Holdings Inc. Warrants,$0.063,0.0002,0.318%,21780992.00,China,,25519,Technology,EDP Services
ED,Consolidated Edison Inc. Common Stock,$102.593,1.483,1.467%,36963860250.00,United States,,919900,Utilities,Power Generation
EDAP,EDAP TMS S.A. American Depositary Shares,$1.72,-0.08,-4.444%,64314388.00,France,1997,37538,Health Care,Biotechnology: Electromedical & Electrotherapeutic Apparatus
EDBL,Edible Garden AG Incorporated Common Stock,$3.11,0.07,2.303%,5147871.00,United States,2022,50635,Consumer Staples,Farming/Seeds/Milling
EDBLW,Edible Garden AG Incorporated Warrant,$0.0854,-0.0036,-4.045%,141360.00,United States,2022,13601,Consumer Staples,Farming/Seeds/Milling
EDD,Morgan Stanley Emerging Markets Domestic Debt Fund Inc. Common Stock,$5.11,-0.04,-0.777%,0.00,United States,2007,121406,Finance,Finance Companies
EDF,Virtus Stone Harbor Emerging Markets Income Fund Common Shares of Beneficial Interest,$5.0346,0.0416,0.833%,0.00,United States,2010,87536,Finance,Investment Managers
EDHL,Everbright Digital Holding Limited Ordinary Shares,$4.52,0.19,4.388%,119780000.00,Hong Kong,2025,677589,Consumer Discretionary,Advertising
EDIT,Editas Medicine Inc. Common Stock,$2.155,0.225,11.658%,180401211.00,United States,2016,2170503,Health Care,Biotechnology: Biological Products (No Diagnostic Substances)
EDN,Empresa Distribuidora Y Comercializadora Norte S.A. (Edenor) American Depositary Shares,$32.20,1.46,4.75%,1459392711.00,Argentina,2007,82364,Utilities,Electric Utilities: Central
EDRY,EuroDry Ltd. Common Shares ,$9.4097,1.0097,12.02%,26598371.00,Greece,,780,Consumer Discretionary,Marine Transportation
EDSA,Edesa Biotech Inc. Common Shares,$1.90,-0.06,-3.061%,6170039.00,United States,,11777,Health Care,Biotechnology: Pharmaceutical Preparations
EDTK,Skillful Craftsman Education Technology Limited Ordinary Share,$0.938,0.008,0.86%,14941825.00,China,2020,3890,Real Estate,Other Consumer Services
EDU,New Oriental Education & Technology Group Inc. Sponsored ADR representing 10 Ordinary Share (Cayman Islands),$48.575,1.185,2.501%,7943413063.00,China,2006,190900,Real Estate,Other Consumer Services
